site,name,lead,highQaulityNews,uncertainSource,nonReliableNews,manipulativeHeading,manipulationsWithEmotions,hateSpeech,fakes,content,persons,images
Vesti.ru,Вести,"На сайті «Вести» під час моніторингу новин було виявлено 73 <span id=""highQaulityNews""></span> достовірних новини, 9 <span id=""uncertainSource""></span> новин з ненадійними джерелами інформації та 18 <span id=""nonReliableNews""></span> недостовірних новин. Серед цих новин 8 <span id=""manipulativeHeading""></span> мали маніпулятивні заголовки, 11 <span id=""manipulationsWithEmotions""></span> новин використовували маніпуляції з емоціями. Також були виявлені 2 <span id=""fakes""></span> фейки та 2 <span id=""hateSpeech""></span> новини, які містили мову ворожнечі.",73,9,18,8,11,2,2,"<p>До новин з ненадійними джерелами інформації були віднесені ті, які використовували представників влади, чиновників як єдине вірне джерело інформації, сумнівні джерела, одну сторону конфлікту тощо. Серед недостовірних новин були ті, в яких були відсутні посилання на джерела, використовувались анонімні джерела, чи власна думка журналіста сприймалася як достовірний факт.</p><p>До новин з маніпулятивними заголовками були віднесені такі матеріали як: «Захарова сообщила об «адской драке» на «семерке», «Асад считает, что война ведется не только против Сирии, но и против России», «На Украине похвастались устроенной в Крыму засухой» тощо. На сайті також досить часто використовувались маніпуляції з емоціями, такі як оціночні судження, маніпулятивний бекграунд, гіперболізація, риторика схожа на радянські ЗМІ, і т.д.</p><p>Також було виявлено і 2 фейки серед досліджуваних новин: «ЕС теряет из-за санкций до 20 млрд евро в год» та «Асад обвинил Британию в пиар-трюке». Крім того, було виявлено 2 новини, в яких була присутня мова ворожнечі спрямована проти українців: «На Украине похвастались устроенной в Крыму засухой» та «Неисчерпаемый юмор одесситов жив. Минобороны РФ о перехвате российского корабля».</p><p>Моніторинг джинси та новин із неналежним маркуванням на цьому сайті не проводився.</p>
",,
Kp.ua,Комсомольская правда в Украине,"На сайті «Комсомольская правда в Украине» під час моніторингу новин було виявлено 76 <span id=""highQaulityNews""></span> достовірних новини, 15 <span id=""uncertainSource""></span> новин з ненадійними джерелами інформації та 9 <span id=""nonReliableNews""></span> недостовірних новин. Серед цих новин 10 <span id=""manipulativeHeading""></span> мали маніпулятивні заголовки, 11 <span id=""manipulationsWithEmotions""></span> новин використовували маніпуляції з емоціями. Також був виявлений один фейк <span id=""fakes""></span> та одна <span id=""hateSpeech""></span> новина, яка містила мову ворожнечі. 
",76,15,9,10,11,1,1,"<p>До новин з ненадійними джерелами інформації були віднесені ті, які використовували представників влади, чиновників як єдине вірне джерело інформації, сумнівні джерела, одну сторону конфлікту тощо. Серед недостовірних новин були ті, в яких були відсутні посилання на джерела, використовувались анонімні джерела, чи власна думка журналіста сприймалася як достовірний факт.</p><p>До новин з маніпулятивними заголовками були віднесені такі матеріали як: «Минздрав предупреждает: от рака все умрут», «Вороны массово атакуют киевлян, орнитологи советуют отбиваться», «Нашествие бабочек на столицу: откуда аномалия и как повлияет на экологию» тощо. На сайті також досить часто використовувались маніпуляції з емоціями, такі як оціночні судження, маніпулятивний бекграунд, гіперболізація і т.д.</p><p>Також був виявлений один фейк серед досліджуваних новин: «Глава «Нафтогаза» Коболев назвал киевлян «посипаками» та новина, в якій використовувалась мова ворожнечі — «Ницой пошла в СБУ по «списку Бабченко», а попала к «русскоговорящим агентам Кремля».</p><p>Під час моніторингу джинси на цьому сайті були виявлені матеріали з неналежним маркуванням.</p>
","лідера Аграрної партії Віталія Скоцика, Ольги Богомолець, Вадима Рабіновича, Гуманітарного штабу Ріната Ахметова, Дніпропетровської ОДА","skocic.jpg,bogomolets.jpg,rabinovich.jpg,ahmetov.jpeg,dniproODA.svg"
Lenta.ru,Лента.ру,"На сайті «Лента.ру» під час моніторингу новин було виявлено 81 <span id=""highQaulityNews""></span> достовірних новин, 18 <span id=""uncertainSource""></span> новин з ненадійними джерелами інформації та одна <span id=""nonReliableNews""></span> недостовірна новина. Серед цих новин 18 <span id=""manipulativeHeading""></span> мали маніпулятивні заголовки, 10 <span id=""manipulationsWithEmotions""></span> новин використовували маніпуляції з емоціями. Також було виявлено 3 <span id=""hateSpeech""></span> новини, які містили мову ворожнечі. Під час аналізу не було виявлено фейків <span id=""fakes""></span>. 
",81,18,1,18,10,3,0,"<p>До новин з ненадійними джерелами інформації були віднесені ті, які посилалися на пости в соціальних мережах, коментарі з соціальних джерел, сумнівні джерела, одну сторону конфлікту тощо.</p><p>До новин з маніпулятивними заголовками були віднесені такі матеріали як: «Уволенный главред отказался ""сытно урча отползать"" от Forbes», «Канадцев запугали войной и террором и отсоветовали ехать в Россию на ЧМ-2018», «Европа попросила Порошенко присоединиться к гей-параду» тощо. На сайті також досить часто використовувались маніпуляції з емоціями, такі як оціночні судження, гіперболізація і т.д.</p><p>Також було виявлено 3 новини, в яких використовувалась мова ворожнечі — здебільшого, спрямована проти представників ЛГБТ-спільноти. Наприклад, «Свадебные наряды лесбиянок посеяли раздор в сети». </p><p>Моніторинг джинси та новин із неналежним маркуванням на цьому сайті не проводився.</p>",,
Focus.ua,Focus.ua,"На сайті «Focus.ua» під час моніторингу новин було виявлено 94 <span id=""highQaulityNews""></span> достовірних новини, 5 <span id=""uncertainSource""></span> новин з ненадійними джерелами інформації та одна <span id=""nonReliableNews""></span> недостовірна новина. Серед цих новин 4 <span id=""manipulativeHeading""></span> мали маніпулятивні заголовки, одна <span id=""manipulationsWithEmotions""></span> новина використовувала маніпуляції з емоціями. Також було виявлено одну <span id=""hateSpeech""></span> новину, яка містила мову ворожнечі. Під час аналізу новин не було виявлено фейків <span id=""fakes""></span>.
",94,5,1,4,1,1,0,"<p>До новин з ненадійними джерелами інформації були віднесені ті, які посилалися на пости в соціальних мережах, коментарі з соціальних джерел, джерела без посилань тощо. Недостовірною новиною була визначена та, в якій заголовок не відповідав тексту новини та був неправдивим — «Путин назвал Навального клоуном». </p><p>До новин з маніпулятивними заголовками були віднесені такі матеріали як: «Силовики перекрывали в Черновцах улицу из-за куска мыла», «Мост Метро в Киеве может рухнуть в любой момент, — автор проекта» тощо. </p><p>Під час моніторингу джинси на цьому сайті не було виявлено матеріалів з ознаками джинси. Втім, були виявлені матеріали з неналежним маркуванням. </p>",,
Fakty.ua,«Факти»,"На сайті «Факти» під час моніторингу новин було виявлено 83 <span id=""highQaulityNews""></span> достовірних новини, 13 <span id=""uncertainSource""></span> новин з ненадійними джерелами інформації та 4 <span id=""nonReliableNews""></span> недостовірних новин. Серед них 6 <span id=""manipulativeHeading""></span> новин мали маніпулятивні заголовки, 3 <span id=""manipulationsWithEmotions""></span> новини використовували маніпуляції з емоціями. Також було виявлено одну <span id=""hateSpeech""></span> новину, яка містила мову ворожнечі. Не було виявлено фейків <span id=""fakes""></span>  під час аналізу новин.
",83,13,4,6,3,1,0,"<p>До новин з ненадійними джерелами інформації були віднесені ті, які посилалися на пости в соціальних мережах, коментарі з соціальних джерел, блоги на різних ресурсах, джерела без посилань, сумнівні джерела тощо. Недостовірними новинами були визнані ті, які не використовували посилань на джерела. Наприклад, «Голден Стэйт» всухую выиграл финальную серию НБА». </p><p>До новин з маніпулятивними заголовками були віднесені такі матеріали як:  «Беларусь обвинила Россию в неадекватности», «Известный российский актер сделал скандальное заявление по Крыму» тощо.</p><p>Також була виявлена новина, яка містила мову ворожнечі, спрямовану проти ромів — «Соцсети: цыгане в Киеве захватывают парки и вырубают деревья. Ждать новых погромов?».</p><p>Під час моніторингу на сайті «Факти» були виявлені матеріали з неналежним маркуванням.</p>
","Вадима Рабіновича, Віталія Кличка, групи ICU","rabinovich.jpg,klichko.jpg,icu.jpeg"
Zaxid.net,Zaxid.net,"На сайті «Zaxid.net» під час моніторингу новин було виявлено 90 <span id=""highQaulityNews""></span> достовірних новини, 4 <span id=""uncertainSource""></span> новини з ненадійними джерелами інформації та 6 <span id=""nonReliableNews""></span> недостовірних новин. Серед цих новин 2 <span id=""manipulativeHeading""></span> мали маніпулятивні заголовки. Не було виявлено новин, які б містили маніпуляції з емоціями <span id=""manipulationsWithEmotions""></span>, мали мову ворожнечі<span id=""hateSpeech""></span>. Також під час аналізу не було виявлено фейків <span id=""fakes""></span>. ",90,4,6,2,0,0,0,"<p>До новин з ненадійними джерелами інформації були віднесені ті, які посилалися на пости у неверифікованих акаунтах в соціальних мережах, а також які мали ознаки замовлення. Наприклад, «У Лівані зникла безвісти хвора на діабет українка». До недостовірних новин також були віднесені матеріали здебільшого з ознаками замовності. Наприклад, «Львів вкотре зустрічатиме Свято Морозива від компанії «РУДЬ». </p><p>До новин з маніпулятивними заголовками були віднесені такі матеріали як: «В Закарпатській ОДА розповіли подробиці про місцеву сепаратистську футбольну команду» та «Команда угорців Закарпаття перемогла на сепаратистському чемпіонаті світу з футболу».</p>
<p>Під час моніторингу джинси на сайті «Zahid.net» не було виявлено матеріалів з ознаками замовлення. Втім, були виявлені матеріали з неналежним маркуванням. </p>
",,
Ria.ru,РИА Новости,"На сайті «РИА Новости» під час моніторингу новин було виявлено 85 <span id=""highQaulityNews""></span> достовірних новин, 11 <span id=""uncertainSource""></span> новин з ненадійними джерелами інформації та 4 <span id=""nonReliableNews""></span> недостовірних новини. Серед цих новин 4 <span id=""manipulativeHeading""></span> мали маніпулятивні заголовки, а 11 <span id=""manipulationsWithEmotions""></span> містили маніпуляції з емоціями. Також був виявлений один <span id=""fakes""></span> фейк та одна <span id=""hateSpeech""></span> новина, яка містила мову ворожнечі.",85,11,4,4,11,1,1,"<p>До новин з ненадійними джерелами інформації були віднесені матеріали з ознаками замовлення, ті, які використовували думку тільки однієї сторони конфлікта, думку чиновника чи політика як достовірний факт. Наприклад, «Путин нас не бросил, детей не бросаем»: жители села на Алтае спасли школу». До недостовірних новин були віднесені матеріали з сумнівними джерелами та ознаками замовлення. Наприклад, в тексті новини «Установлена личность выжившего в Афганистане советского летчика» навіть вказується: «при этом подчеркивается, что информация не точная и требует тщательной проверки».</p> 
<p>На сайті також досить часто використовувались маніпуляції з емоціями, такі як оціночні судження, маніпулятивний бекграунд, гіперболізація і т.д.</p>
<p>Також був виявлений фейк — «Умереть в одиночестве. Как исчезают страны Восточной Европы», де з використанням сумнівних експертів та за відсутності офіційних джерел поширюється пропагандистська риторика. В цьому ж тексті присутня і мова ворожнечі. </p><p>Моніторинг джинси та новин із неналежним маркуванням на цьому сайті не проводився.</p>
",,
Podrobnosti.ua,«Подробності»,"Під час моніторингу сайту «Подробності» було виявлено 81 <span id=""highQaulityNews""></span> достовірних новин, 9 <span id=""uncertainSource""></span> новин з ненадійними джерелами інформації та 10 <span id=""nonReliableNews""></span> недостовірних новин. Крім того, з них 8 <span id=""manipulativeHeading""></span> новин мали маніпулятивні заголовки, 8 <span id=""manipulationsWithEmotions""></span>  — маніпуляції з емоціями. Під час аналізу не було виявлено фейків <span id=""fakes""></span>  та новин, які б містили мову ворожнечі<span id=""hateSpeech""></span>.",81,9,10,8,8,0,0,"<p>До новин з ненадійними джерелами інформації були віднесені матеріали, які використовували сумнівні джерела, не використовували посилань на джерела, хоча інформація була достовірною. Наприклад, «Кому нельзя есть помидоры» чи «Какие опасные болезни можно привезти из отпуска». До недостовірних новин були віднесені ті, в яких були відсутні джерела чи були сумнівними, а також із ознаками замовлення. Наприклад, «В Днепре народные депутаты и фермеры обсудили новый аграрный курс Украины». </p><p>До новин з маніпулятивними заголовками були віднесені такі матеріали як: «В Австрии закроют мечети и вышлют имамов», «В Украине массово подделывают валюту», «Меда не будет: в Украине массово гибнут пчелы» тощо. </p>","Олега Ляшка, Сергія Льовочкіна, Юлії Льовочкіної, Сергія Капліна,  Ірини Акімової, «Лото-Забави»","liashko.jpeg,liovochkin.jpg,liovochkina.JPG,kaplin.jpg,akimova.png,lotozabava.jpeg"
Comments.ua,Комментарии,"На сайті «Комментарии» під час моніторингу новин було виявлено 82 <span id=""highQaulityNews""></span> достовірних новини, 10 <span id=""uncertainSource""></span> новин з ненадійними джерелами інформації та 8 <span id=""nonReliableNews""></span> недостовірних новин. Серед цих новин 5 <span id=""manipulativeHeading""></span> мали маніпулятивні заголовки, а 2 <span id=""manipulationsWithEmotions""></span> містили маніпуляції з емоціями. Під час аналізу не було виявлено фейків <span id=""fakes""></span>  та новин, які б містили мову ворожнечі<span id=""hateSpeech""></span>.
",82,10,8,5,2,0,0,"<p>До новин з ненадійними джерелами інформації були віднесені матеріали, які посилалися на пости у неверифікованих акаунтах в соціальних мережах, сумнівні джерела, використовували коментарі сумнівних експертів тощо. Також до цієї категорії були віднесені і новини з ознаками замовності. Наприклад, «Сергей Рыбалка: «Создаем условия для развития малых и средних банков». До недостовірних новин були віднесені ті, які не містили посилань на джерела взагалі чи не використовували лінки на джерела. Наприклад, «Принц Гарри появился на публике без жены». </p><p>До новин з маніпулятивними заголовками таблоїдного характеру були віднесені такі матеріали як: «Ученые заявили об опаснейшем вирусе, исходящем от собак», «Бабченко отказался в принципе давать бесплатные интервью», «Мадонна шокировала новостью о замужестве» тощо.</p><p>На сайті «Комментарии» під час моніторингу джинси були виявлені матеріали з неналежним маркуванням.</p>","Віктора Медведчука, чорний піар <b>проти</b> Анатолія Гриценка","medvedchuk.jpeg,GRYCENCO.jpg"
