site,name,lead,highQaulityNews,uncertainSource,nonReliableNews,manipulativeHeading,manipulationsWithEmotions,hateSpeech,fakes,content,persons,images
Obozrevatel.com,Обозреватель,"<p>На сайті «Обозреватель» було виявлено 80 <span id=""highQaulityNews""></span> достовірних новин, 15 <span id=""uncertainSource""></span> новин із ненадійними джерелами інформації, а також 5 <span id=""nonReliableNews""></span> недостовірних новин. Серед цих публікацій - 20 <span id=""manipulativeHeading""></span> використовували маніпулятивні заголовки, 5 <span id=""manipulationsWithEmotions""></span> новин містили в собі маніпуляції з емоціями, і одна новина <span id=""hateSpeech""></span>  містила мову ворожнечі. Фейків <span id=""fakes""></span> під час моніторингу не було виявлено.</p>",80,15,5,20,5,1,0,"<p>Серед ненадійних джерел «Обозреватель» використовував пости з неверифікованих акаунтів в соціальних мережах, посилання на сумнівні сайти, заяви політиків з ознаками джинси. До недостовірних новин потрапили публікації з ознаками джинси, новини про ситуацію у так званій «ЛНР», використовували недостовірні джерела. Наприклад, «Конец света 2018: ответ карт Таро”. </p><p>В новинах на сайті використовувалися такі маніпулятивні заголовки як: «Вытесним Россию: выяснились оружейные планы Украины», «Затопит по всей Украине: Тука предупредил о новой опасности с Донбасса», «Сотрет с лица земли: климатологи предупредили о бушующих стихиях», і т.д. </p><p>В одній новині містилася мова ворожнечі - «Скандал из-за УПА: историк обвинил Польшу в методах нацистов».</p>","міського голови Дніпра Бориса Філатова, Юлії Тимошенко, Олега Ляшка, медицинської клініки «Добробут», лотереї «Лото-Забава»","filatov.jpg,tymoshenko.jpeg,liashko.jpeg,dobrobut.png,lotozabava.jpeg"
Segodnya.ua,Cегодня,"На сайті «Сегодня» було виявлено 88 <span id=""highQaulityNews""></span> достовірних новин, 6  <span id=""uncertainSource""></span> з ненадійними джерелами інформації, а також 6 <span id=""nonReliableNews""></span> недостовірних новин. Серед цих новин - 6 <span id=""manipulativeHeading""></span> містили маніпулятивні заголовки, одна <span id=""manipulationsWithEmotions""></span> новина містила маніпуляції з емоціями, і одна <span id=""hateSpeech""></span>  новина містила мову ворожнечі. Фейків <span id=""fakes""></span> під час моніторингу не було виявлено.",88,6,6,6,1,1,0,"<p>В новинах із ненадійними джерелами використовувались посилання на пости неверифікованих акаунтів в соціальних мережах. До недостовірних новин потрапили новини з ознаками замовлення. </p><p>До новин із маніпулятивними заголовками були віднесені публікації, де текст не збігався із заголовком, містилися узагальнення і оціночні судження. Наприклад, «Прямая линия с Путиным стала хитом в соцсетях».</p><p>Мова ворожнечі містилася в новині щодо ДТП, в якій недоречно згадувалося громадянство звинуваченого. </p><p>Також були виявлені матеріали з неналежним маркуванням.</p>","Бориса Колеснікова, Гуманітарного штабу Ріната Ахметова, Олега Ляшка","kolesnikov.jpeg,ahmetov.jpeg,liashko.jpeg"
Tsn.ua,ТСН,"На сайті «ТСН» під час моніторингу було виявлено 90 <span id=""highQaulityNews""></span> достовірних новин, 6 <span id=""uncertainSource""></span> новин із ненадійними джерелами інформації, 4 <span id=""nonReliableNews""></span> недостовірних новин. Серед цих новин — одна <span id=""manipulativeHeading""></span> новина мала маніпулятивний заголовок, 2 <span id=""manipulationsWithEmotions""></span> новини містили маніпуляції з емоціями. Фейків <span id=""fakes""></span>та новин, які б містили мову ворожнечі<span id=""hateSpeech""></span>, під час моніторингу не було виявлено.",90,6,4,1,2,0,0,"<p>В новинах із ненадійними джерелами інформації використовувалися пости з неверифікованих акаунтів у соціальних мережах, посилання на сумнівні джерела. До недостовірних новин були віднесені публікації з ознаками замовлення, чи новини, які не мали посилань на джерела. </p><p>До новин із маніпулятивними заголовками були віднесена публікація — «Західні вчені заявили про радіоактивне молоко в Україні». </p><p>Під час моніторингу джинси новин з ознаками замовлення не було зафіксовано, проте були новини із неналежним маркуванням під рубриками «Новости компаний», «Вікно», «Актуально», тощо. </p>",,
24tv.ua,24 канал,"На сайті «24 канал» під час моніторингу виявлено 79 <span id=""highQaulityNews""></span> достовірних новин, 14 <span id=""uncertainSource""></span> новин із ненадійними джерелами інформації, а також 7 <span id=""nonReliableNews""></span> недостовірних новин. Серед цих новин — 3 <span id=""manipulativeHeading""></span> мали маніпулятивні заголовки, 2 <span id=""manipulationsWithEmotions""></span> новини використовували маніпуляції з емоціями. Разом з тим, не було зафіксовано жодних фейків <span id=""fakes""></span>, а також новин, які б містили мову ворожнечі <span id=""hateSpeech""></span>.",79,14,7,3,2,0,0,"<p>В новинах із ненадійними джерелами інформації використовувались пости із неверифікованих акаунтів в соціальних мережах, посилання на сумнівні джерела. До недостовірних новин були віднесені публікації з ознаками замовлення, ті, в яких були відсутні джерела взагалі. Наприклад, «Дропшипінг: чому цей вид заробітку набирає популярності?».</p>
<p>До новин, де були присутні маніпуляції з емоціями, були віднесені публікації, які містили оціночні судження. Наприклад, «Ромен Грожан збив бабака під час практики гран-прі Канади». </p>
<p>Під час моніторингу джинси були виявлені матеріали з неналежним маркуванням. </p>",політичної партії «Самопоміч»,samopomich.jpg
Rbc.ua,РБК-Україна,"На сайті «РБК-Україна» під час моніторингу було виявлено 96 <span id=""highQaulityNews""></span> достовірних новин, 4 <span id=""uncertainSource""></span> новини з ненадійними джерелами інформаціями. Також була зафіксована одна <span id=""manipulativeHeading""></span> новина із маніпулятивним заголовком. Разом з тим, не було зафіксовано жодних фейків <span id=""fakes""></span>, <span id=""nonReliableNews""></span>недостовірних новин, новин, які б містили маніпуляції з емоціями <span id=""manipulationsWithEmotions""></span> та мову ворожнечі<span id=""hateSpeech""></span>.",96,4,0,1,0,0,0,"<p>До новин із ненадійними джерелами інформації були віднесені публікації з посиланнями на пости з неверифікованих акаунтів соціальних мереж, а також матеріали з ознаками замовлення. Наприклад, «В «Відродженні» считают, что заявление Линчевского об онкобольных содержит признаки нацизма». </p>","політика Вадима Рабіновича, представника «Народного фронту» Максима Бурбака, голови Харківської ОДА Юлії Світличної, Юлії Тимошенко","rabinovich.jpg,maksimBurbak.jpg,svitlychna.jpg,tymoshenko.jpeg"
Unian.net,УНІАН,"На сайті інформагентства «УНІАН» під час моніторингу було виявлено 94 <span id=""highQaulityNews""></span> достовірних новини, а також 5 <span id=""uncertainSource""></span> новин із ненадійними джерелами інформації та одна <span id=""nonReliableNews""></span> недостовірна новина. Також було виявлено 2 <span id=""manipulativeHeading""></span> новини із маніпулятивними заголовками та одна <span id=""manipulationsWithEmotions""></span> новина, в якій використовувалися маніпуляції з емоціями. Разом з тим, не було виявлено жодних фейків <span id=""fakes""></span> та новин, які б містили мову ворожнечі<span id=""hateSpeech""></span>.",94,5,1,2,1,0,0,"<p>Новини з ненадійними джерелами інформації використовували пости з неверифікованих акаунтів соціальних мереж, сумнівні джерела. Прикладом новини з маніпулятивним заголовком є — «Польше трудно без дешевой рабочей силы — СМИ».</p><p>До недостовірної новини була віднесена публікація про «Пожар в Чернобыле — что делать и как защитить себя от радиации», де було відсутнє посилання на джерела, до того ж заява про небезпечність пожежі у Чорнобилі для мешканців Києва не була підтверджена жодним з офіційних джерел. </p>
","УПЦ МП та РПЦ, «Народного фронту», політика Вадима Рабіновича, мера Дніпра Бориса Філатова, «Укрбудінвестбанку», Української національної лотереї","rpc.jpeg,narodnyFront.png,rabinovich.jpg,filatov.jpg,ukrbudinvestbank.jpeg,ukrnaclot.gif"
Nv.ua,Новое время,"На сайті «Новое время» під час моніторингу 99 <span id=""highQaulityNews""></span> новин були достовірними. Одна <span id=""uncertainSource""></span> новина мала ненадійне джерело інформації.",99,0,1,0,0,0,0,"<p>До новини з ненадійними джерелами інформації був віднесений матеріал «Из Украины открыли новый авиарейс в Турцию», який містив ознаки замовлення на користь Bravo Airways. </p><p>Не було виявлено жодних фейків <span id=""fakes""></span>, <span id=""nonReliableNews""></span> недостовірних новин, новин із маніпулятивним заголовком, мовою ворожнечі, оціночними судженнями. </p><p>Під час моніторингу джинси не було виявлено новин з ознаками замовлення. Втім, були зафіксовані новини з неналежним маркуванням. </p>",,
Ictv.ua,ICTV,"На сайті «ICTV», у підрозділі програми новин «Факти» під час моніторингу було виявлено 88 <span id=""highQaulityNews""></span> достовірних новин, 7 <span id=""uncertainSource""></span> новин з ненадійними джерелами інформації та 5 <span id=""nonReliableNews""></span> недостовірних новин. Серед цих новин — 3 <span id=""manipulativeHeading""></span>містили маніпулятивні заголовки, одна <span id=""manipulationsWithEmotions""></span> містила маніпуляції з емоціями. Крім того, був виявлений один <span id=""fakes""></span> фейк. Не було виявлено новин, які б містили мову ворожнечі<span id=""hateSpeech""></span>. ",88,7,5,3,1,0,1,"<p>Серед новин із ненадійними джерелами інформації використовувалися пости з неверифікованих акаунтів соціальних мереж, сумнівні джерела, у випадку смерті дитини від кору були відсутні заяви чи коментарі офіційних джерел тощо. Прикладом маніпулятивного заголовку, а також використання маніпуляцій з емоціями в одному й тому ж тексті є «У Києві шматок бетону впав з моста на Renault — пасажиру майже відірвало руку».</p><p>Також було виявлено поширення фейку — «До парламенту проходять 8 партій на чолі з Тимошенко і Порошенко — західні соціологи», де використовувалися результати опитування фейкового міжнародного дослідницького центру BURI-Україна (The Belgium-Ukraine Research Institute).</p>","Ольги Богомолець, Вадима Новинського, проекту «Нові лідери», а також голови Одеської ОДА Максима Степанова","bogomolets.jpg,novynskyi.jpg,novilidery.jpeg,stepanov.jpg"
Strana.ua,Страна.юа,"На сайті «Страна.юа» під час моніторингу було виявлено 77 <span id=""highQaulityNews""></span> достовірних новини, 18 <span id=""uncertainSource""></span> новин містили ненадійні джерела, 5 <span id=""nonReliableNews""></span>новин були недостовірними. Серед цих публікацій 16 <span id=""manipulativeHeading""></span> новин мали маніпулятивні заголовки, 19 <span id=""manipulationsWithEmotions""></span> новин містили маніпуляції з емоціями. Під час аналізу не було виявлено фейків <span id=""fakes""></span>, а також новин, які б містили мову ворожнечі<span id=""hateSpeech""></span>. ",77,18,5,16,19,0,0,"<p>До новин з ненадійними джерелами інформації були віднесені ті, які містили посилання на пости із неверифікованих акаунтів соціальних мереж, сумнівні анонімні джерела тощо. </p><p>Серед недостовірних новин були відзначені новини без посилань, які разом з тим містили маніпулятивні заголовки, оціночні судження. Наприклад, «Больная семерка. Как саммит G7 разделил США и Европу, став самым провальным в истории». Інший приклад — «Порошенко обвинил СМИ в преувеличении коррупции в Украине», де заголовок повністю не відповідає тексту новини. На сайті досить використовуються і маніпуляції з емоціями, як додавання маніпулятивного бекграунду.   </p><p>Під час моніторингу джинси не було виявлено новин з ознаками замовності, а також новин із неналежним маркуванням. </p>",,
Gordonua.com,Гордон,"На сайті «Гордон» під час моніторингу було виявлено 94 <span id=""highQaulityNews""></span> достовірних новини та 6 <span id=""uncertainSource""></span> новин із ненадійним джерелом інформації. Також було зафіксовано одну новину, яка містила мову ворожнечі <span id=""hateSpeech""></span>. ",94,6,0,0,0,1,0,"<p>До ненадійних джерел були віднесені публікації з посиланнями на пости в соціальних мережах, сумнівні джерела, прес-службу так званої «ДНР» тощо. </p><p>Під час моніторингу джинси були виявлені матеріали із неналежним маркуванням.</p>","Аграрної партії, Вадима Рабіновича, «Опозиційного блоку», Юлії Тимошенко, Гуманітарного Штабу Ріната Ахметова","agrarna.jpg,rabinovich.jpg,opoblock.jpg,tymoshenko.jpeg,ahmetov.jpeg"
Pravda.com.ua,Українська правда,"На сайті «Українська правда» під час моніторингу було виявлено 96 <span id=""highQaulityNews""></span> достовірних новин, 3 <span id=""uncertainSource""></span> новини з ненадійними джерелами інформації та одна <span id=""nonReliableNews""></span> недостовірна новина. ",96,3,1,0,0,0,0,"<p>До новин, які використовували ненадійні джерела інформації, були віднесені ті, які посилалися на пости неверифікованих акаунтів в соцмережах, сумнівні джерела тощо.</p><p>Також була зафіксована одна недостовірна новина «Фото дня: у Балі створили веселкову хвилю шльопанців, що викинув океан», де подавалися цитати мисткині без посилання, звідки вони були взяті.</p><p>Під час моніторингу джинси на сайті не було виявлено новин з ознаками замовності чи новин із неналежним маркуванням. </p>",,
Znaj.ua,Znaj.ua,"Під час моніторингу на сайті «Znaj.ua» було виявлено 54 <span id=""highQaulityNews""></span> достовірних новини, 25 <span id=""nonReliableNews""></span> недостовірних новин, 21 <span id=""uncertainSource""></span> новин з ненадійними джерелами інформації. Крім того, було виявлено 30 <span id=""manipulativeHeading""></span> новин з маніпулятивними заголовками, 12 <span id=""manipulationsWithEmotions""></span> новин, які містили оціночні судження. Був виявлений один <span id=""fakes""></span>  фейк, а також один матеріал, який містив мову ворожнечі <span id=""hateSpeech""></span> . ",54,21,25,30,12,1,1,"<p>До новин із ненадійними джерелами інформації були віднесені ті, які посилалися на пости в соціальних мережах, коментарі з соціальних джерел, сумнівні анонімні джерела, а також ті, які мали ознаки замовлення. До недостовірних потрапили новини, в яких було відсутнє посилання на джерела, думка тільки однієї сторони, коли йшлася мова про конфлікт, чи новини з ознаками замовлення.</p><p>Прикладами маніпулятивних заголовків, які були виявлені на сайті, є: «Діти помирають: Супрун попередила українців про літню небезпеку», «Це тільки початок: Австрія жене в шию імамів і закриває мечеті», «Ріки крові і багато постраждалих: маршрутка розгубила пасажирів по дорозі» тощо. У новинах досить часто використовуються узагальнення, оціночні судження, гіперболізація тощо. Крім того, було виявлено поширення фейку, спрямованого проти голови правління НАК «Нафтогаз» Андрія Коболєва («Київ без води і світла: Коболєв провернув аферу року»), а також використання мови ворожнечі у новині «Погром табору ромів у Києві: версії сторін та ставлення українців до проблеми».</p> ","Віктора Медведчука, Вадима Новінського, Олега Ляшка,чорний піар <b>проти</b> супермаркету «АТБ»","medvedchuk.jpeg,novynskyi.jpg,liashko.jpeg,atb.png"
